{
  "schema_version": 1,
  "generator": {
    "source": "scribekey-models",
    "format_version": "1.0.0"
  },
  "speech": {
    "models": [
      {
        "id": "moonshine-tiny",
        "outcome": "LIGHTWEIGHT",
        "family": "MOONSHINE",
        "displayName": "Moonshine Tiny",
        "badge": "",
        "diskMb": 124,
        "minRamMb": 2048,
        "minApiLevel": 28,
        "transcriptionMode": "SEGMENTED",
        "supportsTimestamps": false,
        "supportsPunctuation": false,
        "supportsLanguageDetection": false,
        "files": [
          {
            "name": "preprocess.onnx",
            "downloadUrl": "https://huggingface.co/csukuangfj/sherpa-onnx-moonshine-tiny-en-int8/resolve/bf2b762c076d8ea61e2af0b3851c9564fb77552e/preprocess.onnx",
            "sizeBytes": 6800738,
            "sha256": "f33addce61a143460fe753b5ee5b7db255e5140b5b779c065b94f6c83ff0bf4e"
          },
          {
            "name": "encode.int8.onnx",
            "downloadUrl": "https://huggingface.co/csukuangfj/sherpa-onnx-moonshine-tiny-en-int8/resolve/bf2b762c076d8ea61e2af0b3851c9564fb77552e/encode.int8.onnx",
            "sizeBytes": 18249187,
            "sha256": "8774dfba578de027ec6595c2c654a0836434489bc963a0db124a7f181f571acb"
          },
          {
            "name": "uncached_decode.int8.onnx",
            "downloadUrl": "https://huggingface.co/csukuangfj/sherpa-onnx-moonshine-tiny-en-int8/resolve/bf2b762c076d8ea61e2af0b3851c9564fb77552e/uncached_decode.int8.onnx",
            "sizeBytes": 53216096,
            "sha256": "216737000dd5881a17aa043f6bbd286add33e4c3b0ae257153e2ec15438bdc41"
          },
          {
            "name": "cached_decode.int8.onnx",
            "downloadUrl": "https://huggingface.co/csukuangfj/sherpa-onnx-moonshine-tiny-en-int8/resolve/bf2b762c076d8ea61e2af0b3851c9564fb77552e/cached_decode.int8.onnx",
            "sizeBytes": 45264830,
            "sha256": "2aff28bba6a03d8dcf5c9feac45462629bae37317442299f28115ad09da773f6"
          },
          {
            "name": "tokens.txt",
            "downloadUrl": "https://huggingface.co/csukuangfj/sherpa-onnx-moonshine-tiny-en-int8/resolve/bf2b762c076d8ea61e2af0b3851c9564fb77552e/tokens.txt",
            "sizeBytes": 436688,
            "sha256": "1165c2aeb9f72f457a83be2d459a09054f27490acd9b41bd43794dfd25e296ea"
          }
        ],
        "sherpaConfig": {
          "type": "moonshine",
          "modelDir": ""
        },
        "info": {
          "paramsBadge": "26M",
          "architecture": "Encoder-Decoder",
          "languages": "English"
        }
      },
      {
        "id": "moonshine-base",
        "outcome": "LIGHTWEIGHT",
        "family": "MOONSHINE",
        "displayName": "Moonshine Base",
        "badge": "",
        "diskMb": 287,
        "minRamMb": 2048,
        "minApiLevel": 28,
        "transcriptionMode": "SEGMENTED",
        "supportsTimestamps": false,
        "supportsPunctuation": false,
        "supportsLanguageDetection": false,
        "files": [
          {
            "name": "preprocess.onnx",
            "downloadUrl": "https://huggingface.co/csukuangfj/sherpa-onnx-moonshine-base-en-int8/resolve/052b0798ad1bf046a140fdd4efcd9426530fa3f5/preprocess.onnx",
            "sizeBytes": 14077290,
            "sha256": "ffa630d395c5ccf76f5d4954be5b882df76aaf6491519ec01fd82ea7a3819fb2"
          },
          {
            "name": "encode.int8.onnx",
            "downloadUrl": "https://huggingface.co/csukuangfj/sherpa-onnx-moonshine-base-en-int8/resolve/052b0798ad1bf046a140fdd4efcd9426530fa3f5/encode.int8.onnx",
            "sizeBytes": 50311494,
            "sha256": "7e38770f776f2e5583a53b052936005df2ba5c833d7e09c2a5fd796b94bf73e2"
          },
          {
            "name": "uncached_decode.int8.onnx",
            "downloadUrl": "https://huggingface.co/csukuangfj/sherpa-onnx-moonshine-base-en-int8/resolve/052b0798ad1bf046a140fdd4efcd9426530fa3f5/uncached_decode.int8.onnx",
            "sizeBytes": 122120451,
            "sha256": "c01f4b35093bcac20d352d23a75a539e772964579f9d024a90e5e6f09cae9987"
          },
          {
            "name": "cached_decode.int8.onnx",
            "downloadUrl": "https://huggingface.co/csukuangfj/sherpa-onnx-moonshine-base-en-int8/resolve/052b0798ad1bf046a140fdd4efcd9426530fa3f5/cached_decode.int8.onnx",
            "sizeBytes": 99983837,
            "sha256": "2db74e51cedf64a8b1be3c8192e0bb5e4923af0e90bd9e87f8e8771873f8ea03"
          },
          {
            "name": "tokens.txt",
            "downloadUrl": "https://huggingface.co/csukuangfj/sherpa-onnx-moonshine-base-en-int8/resolve/052b0798ad1bf046a140fdd4efcd9426530fa3f5/tokens.txt",
            "sizeBytes": 436688,
            "sha256": "1165c2aeb9f72f457a83be2d459a09054f27490acd9b41bd43794dfd25e296ea"
          }
        ],
        "sherpaConfig": {
          "type": "moonshine",
          "modelDir": ""
        },
        "info": {
          "paramsBadge": "58M",
          "architecture": "Encoder-Decoder",
          "languages": "English"
        }
      },
      {
        "id": "distil-small-en",
        "outcome": "LIGHTWEIGHT",
        "family": "DISTIL_WHISPER",
        "displayName": "Distil-Whisper Small",
        "badge": "",
        "diskMb": 299,
        "minRamMb": 3072,
        "minApiLevel": 28,
        "transcriptionMode": "SEGMENTED",
        "supportsTimestamps": false,
        "supportsPunctuation": false,
        "supportsLanguageDetection": false,
        "files": [
          {
            "name": "encoder.int8.onnx",
            "downloadUrl": "https://huggingface.co/csukuangfj/sherpa-onnx-whisper-distil-small.en/resolve/0492324bca9e12a6fca0089bb846f2dd723b50d8/distil-small.en-encoder.int8.onnx",
            "sizeBytes": 102961431,
            "sha256": "397a76d2308c2c1ec91a4ecc12f20fede69bb17be41a1cef050993520328beca"
          },
          {
            "name": "decoder.int8.onnx",
            "downloadUrl": "https://huggingface.co/csukuangfj/sherpa-onnx-whisper-distil-small.en/resolve/0492324bca9e12a6fca0089bb846f2dd723b50d8/distil-small.en-decoder.int8.onnx",
            "sizeBytes": 195079097,
            "sha256": "3074092bca078786ecda9c9e88449f14e9ebde1d60be4d41de8cacda55e065e0"
          },
          {
            "name": "tokens.txt",
            "downloadUrl": "https://huggingface.co/csukuangfj/sherpa-onnx-whisper-distil-small.en/resolve/0492324bca9e12a6fca0089bb846f2dd723b50d8/distil-small.en-tokens.txt",
            "sizeBytes": 835554,
            "sha256": "306cd27f03c1a714eca7108e03d66b7dc042abe8c258b44c199a7ed9838dd930"
          }
        ],
        "sherpaConfig": {
          "type": "whisper",
          "modelDir": ""
        },
        "info": {
          "paramsBadge": "190M",
          "architecture": "Encoder-Decoder",
          "languages": "English"
        }
      },
      {
        "id": "parakeet-110m",
        "outcome": "LIGHTWEIGHT",
        "family": "PARAKEET",
        "displayName": "Parakeet 110M",
        "badge": "",
        "diskMb": 458,
        "minRamMb": 3072,
        "minApiLevel": 28,
        "transcriptionMode": "SEGMENTED",
        "supportsTimestamps": true,
        "supportsPunctuation": true,
        "supportsLanguageDetection": false,
        "files": [
          {
            "name": "model.onnx",
            "downloadUrl": "https://huggingface.co/csukuangfj/sherpa-onnx-nemo-parakeet_tdt_ctc_110m-en-36000/resolve/3af92f152d32c836acabf38f4c993bc96b80eb2d/model.onnx",
            "sizeBytes": 458161021,
            "sha256": "936806cf3dd0db5aba53f8c7410bb5632d7a8ad6b2c51009f5e4fc0890ec76bf"
          },
          {
            "name": "tokens.txt",
            "downloadUrl": "https://huggingface.co/csukuangfj/sherpa-onnx-nemo-parakeet_tdt_ctc_110m-en-36000/resolve/3af92f152d32c836acabf38f4c993bc96b80eb2d/tokens.txt",
            "sizeBytes": 9953,
            "sha256": "450e56bd2f036fe5b6aa821865838cc5aa9d8b0106134ce9a9ba0664abe6cd10"
          }
        ],
        "sherpaConfig": {
          "type": "nemo_ctc",
          "modelDir": ""
        },
        "info": {
          "paramsBadge": "110M",
          "architecture": "TDT-CTC",
          "languages": "English"
        }
      },
      {
        "id": "canary-180m",
        "outcome": "MULTILINGUAL",
        "family": "CANARY",
        "displayName": "Canary 180M",
        "badge": "",
        "diskMb": 207,
        "minRamMb": 4096,
        "minApiLevel": 28,
        "transcriptionMode": "SEGMENTED",
        "supportsTimestamps": true,
        "supportsPunctuation": true,
        "supportsLanguageDetection": true,
        "files": [
          {
            "name": "encoder.int8.onnx",
            "downloadUrl": "https://huggingface.co/csukuangfj/sherpa-onnx-nemo-canary-180m-flash-en-es-de-fr-int8/resolve/9077164e0d3dd1d5353743e89ceaa1d3a770838c/encoder.int8.onnx",
            "sizeBytes": 132678643,
            "sha256": "7a75b4e2a5857a6dcc0819503bbe3fad66943db4a3ccf21d3f27c633667d303f"
          },
          {
            "name": "decoder.int8.onnx",
            "downloadUrl": "https://huggingface.co/csukuangfj/sherpa-onnx-nemo-canary-180m-flash-en-es-de-fr-int8/resolve/9077164e0d3dd1d5353743e89ceaa1d3a770838c/decoder.int8.onnx",
            "sizeBytes": 74437848,
            "sha256": "e41a2ab9c0c2fe81a1e8ade5a45fb02a74bc4db7d1f91b89a54a25e2cf79cba2"
          },
          {
            "name": "tokens.txt",
            "downloadUrl": "https://huggingface.co/csukuangfj/sherpa-onnx-nemo-canary-180m-flash-en-es-de-fr-int8/resolve/9077164e0d3dd1d5353743e89ceaa1d3a770838c/tokens.txt",
            "sizeBytes": 53555,
            "sha256": "2dae6fc7815f9640645e0c765522b278ee0cef49b482d91f6913e334628d3e77"
          }
        ],
        "sherpaConfig": {
          "type": "canary",
          "modelDir": ""
        },
        "info": {
          "paramsBadge": "180M",
          "architecture": "CTC Flash",
          "languages": "Multilingual"
        }
      },
      {